A1: Freq, Hz | B1: Lead
A2: 50 | B2: =1/(2*SIN(PI()*0.00009*A2)) -> 35.368943256247597
A3: 60 | B3: =1/(2*SIN(PI()*0.00009*A3)) -> 29.474551373773313
A4: 70 | B4: =1/(2*SIN(PI()*0.00009*A4)) -> 25.26433879118882
A5: 80 | B5: =1/(2*SIN(PI()*0.00009*A5)) -> 22.106738275321486
A6: 90 | B6: =1/(2*SIN(PI()*0.00009*A6)) -> 19.650879141661783
A7: 100 | B7: =1/(2*SIN(PI()*0.00009*A7)) -> 17.686238980031852
A8: 120 | B8: =1/(2*SIN(PI()*0.00009*A8)) -> 14.739396617979526
A9: 140 | B9: =1/(2*SIN(PI()*0.00009*A9)) -> 12.634643965232044
A10: 160 | B10: =1/(2*SIN(PI()*0.00009*A10)) -> 11.056197415107047
A11: 180 | B11: =1/(2*SIN(PI()*0.00009*A11)) -> 9.8286216352586244
A12: 200 | B12: =1/(2*SIN(PI()*0.00009*A12)) -> 8.8466554305123175
A13: 220 | B13: =1/(2*SIN(PI()*0.00009*A13)) -> 8.0433144077904757
A14: 240 | B14: =1/(2*SIN(PI()*0.00009*A14)) -> 7.3739423085753133
A15: 260 | B15: =1/(2*SIN(PI()*0.00009*A15)) -> 6.8076232648508865
A16: 280 | B16: =1/(2*SIN(PI()*0.00009*A16)) -> 6.3222745167845238
A17: 300 | B17: =1/(2*SIN(PI()*0.00009*A17)) -> 5.9017020433359715
A18: 350 | B18: =1/(2*SIN(PI()*0.00009*A18)) -> 5.060793988468709
A19: 400 | B19: =1/(2*SIN(PI()*0.00009*A19)) -> 4.4304095028431743
A20: 450 | B20: =1/(2*SIN(PI()*0.00009*A20)) -> 3.9403746160818915
A21: 500 | B21: =1/(2*SIN(PI()*0.00009*A21)) -> 3.5485850132346117
A22: 550 | B22: =1/(2*SIN(PI()*0.00009*A22)) -> 3.2282471008198352
A23: 600 | B23: =1/(2*SIN(PI()*0.00009*A23)) -> 2.961498539881942
A24: 650 | B24: =1/(2*SIN(PI()*0.00009*A24)) -> 2.7359731484405181
A25: 700 | B25: =1/(2*SIN(PI()*0.00009*A25)) -> 2.5428379886361303
A26: 750 | B26: =1/(2*SIN(PI()*0.00009*A26)) -> 2.3756156190479381
A27: 800 | B27: =1/(2*SIN(PI()*0.00009*A27)) -> 2.2294480024208414
A28: 850 | B28: =1/(2*SIN(PI()*0.00009*A28)) -> 2.1006202106927718
A29: 900 | B29: =1/(2*SIN(PI()*0.00009*A29)) -> 1.9862428950391324
A30: 950 | B30: =1/(2*SIN(PI()*0.00009*A30)) -> 1.8840350285600813
A31: 1000 | B31: =1/(2*SIN(PI()*0.00009*A31)) -> 1.7921718261860802